{
  "$schema": "../../../../schema/shape.schema.json",
  "owner": "/parts/parser/parts/create-table-stmt",

  "imports": {
    "Token":      "/parts/parser/parts/tokenizer",
    "TokenKind":  "/parts/parser/parts/tokenizer",
    "Expr":       "/parts/parser/parts/expr",
    "ParseError": "/parts/parser/parts/expr"
  },

  "types": {
    "ColumnConstraint": {
      "kind": "variant",
      "doc": "Per-column constraint, attached after the optional type-name. The grammar admits multiple constraints in sequence; downstream compilers fold them into table metadata.",
      "cases": {
        "NotNull":    { "doc": "`NOT NULL`." },
        "PrimaryKey": { "doc": "`PRIMARY KEY [ASC|DESC]`. `ascending = true` for ASC or omitted, false for DESC.",
                         "fields": { "ascending": "bool" } },
        "Unique":     { "doc": "`UNIQUE`." },
        "Default":    { "doc": "`DEFAULT <expr>` — value supplied when row omits the column. Expr may be any literal or parenthesized expression admitted by parse_expr.",
                         "fields": { "value": "Expr" } },
        "Check":      { "doc": "`CHECK (<expr>)` — column-level check.",
                         "fields": { "expr": "Expr" } },
        "References": { "doc": "`REFERENCES <table> [(col [, col ...])]` — column-level FK shorthand. ON DELETE / ON UPDATE actions are deferred.",
                         "fields": { "table": "string", "columns": { "list": "string" } } },
        "Collate":    { "doc": "`COLLATE <name>` — collation override.",
                         "fields": { "name": "string" } },
        "Generated":  { "doc": "`[GENERATED ALWAYS] AS (<expr>) [STORED|VIRTUAL]`. `stored = true` for STORED, false for VIRTUAL or omitted (VIRTUAL is the default).",
                         "fields": { "expr": "Expr", "stored": "bool" } }
      }
    },

    "ColumnDef": {
      "kind": "record",
      "doc": "One column declaration in a CREATE TABLE column list. The type-name is optional (SQLite admits typeless columns); when present it is the raw token text concatenated with spaces (e.g. `VARCHAR`, `DOUBLE PRECISION`, or `INT`). Multi-token type names admit one space-separated `Ident` sequence. Parameterized type names like `VARCHAR(30)` or `DECIMAL(10, 2)` are admitted; the integer arguments are captured in `type_params` (zero, one, or two entries). The type-name string itself does NOT include the parens; downstream consumers that don't care about width treat ColumnDef as if `type_params` was empty (CAST normalization pattern).",
      "fields": {
        "name":        "string",
        "type_name":   { "option": "string" },
        "type_params": { "list": "u32" },
        "constraints": { "list": "ColumnConstraint" }
      }
    },

    "TableConstraint": {
      "kind": "variant",
      "doc": "Table-level constraint, written after the column list (still inside the column-list parens, separated by comma from the last column).",
      "cases": {
        "PrimaryKey": { "doc": "`PRIMARY KEY (col [, col ...])`.",
                         "fields": { "columns": { "list": "string" } } },
        "Unique":     { "doc": "`UNIQUE (col [, col ...])`.",
                         "fields": { "columns": { "list": "string" } } },
        "Check":      { "doc": "`CHECK (<expr>)` — table-level check.",
                         "fields": { "expr": "Expr" } },
        "ForeignKey": { "doc": "`FOREIGN KEY (col [, col ...]) REFERENCES <table> [(col [, col ...])]`. ON DELETE / ON UPDATE actions deferred.",
                         "fields": { "columns":     { "list": "string" },
                                     "ref_table":   "string",
                                     "ref_columns": { "list": "string" } } }
      }
    },

    "CreateTableStmt": {
      "kind": "record",
      "doc": "Parsed CREATE TABLE statement. Covers `CREATE TABLE [IF NOT EXISTS] <name> ( <col_def> [, <col_def>]* [, <table_constraint>]* ) [WITHOUT ROWID|STRICT [, WITHOUT ROWID|STRICT]]`. Schema-qualified names, temp tables, and AS-SELECT form are deferred. Parameterized type names (`VARCHAR(30)`, `DECIMAL(10,2)`) are admitted — see ColumnDef.type_params.",
      "fields": {
        "name":              "string",
        "if_not_exists":     "bool",
        "columns":           { "list": "ColumnDef" },
        "table_constraints": { "list": "TableConstraint" },
        "without_rowid":     "bool",
        "strict":            "bool"
      }
    },

    "CreateTableParseOk": {
      "kind": "record",
      "doc": "Successful parse output: the CreateTableStmt plus the index of the next un-consumed token (typically `;` or `Eof`).",
      "fields": {
        "stmt": "CreateTableStmt",
        "next": "u32"
      }
    }
  },

  "functions": {
    "parse_create_table": {
      "doc": "Parse a `CREATE TABLE` statement. Token at `start` must be `KwCreate`. Delegates to parse_expr for `DEFAULT`, `CHECK`, and `GENERATED ALWAYS AS` expressions. Admits parameterized type names (one or two integer args, captured in ColumnDef.type_params). Rejects deferred forms (`TEMP`, `AS SELECT`, schema-qualified names, ON DELETE/UPDATE actions) with `deferred: <construct>` ParseError.",
      "params": [
        { "name": "tokens", "type": { "borrow": { "list": "Token" } } },
        { "name": "start",  "type": "u32" }
      ],
      "returns": { "result": { "ok": "CreateTableParseOk", "err": "ParseError" } }
    },

    "pk_from_create_stmt": {
      "doc": "Detect the rowid-alias INTEGER PRIMARY KEY column on a parsed CreateTableStmt. SQLite admits exactly one column as a rowid alias when ALL of these hold: (a) the column carries a column-level `PRIMARY KEY` constraint (ColumnConstraint::PrimaryKey); (b) its declared type-name is exactly `INTEGER` matched ASCII-case-insensitively (so `Integer`, `integer`, `INTEGER` qualify; `INT`, `BIGINT`, `INTEGER(11)` with type_params do NOT — the type_params list MUST be empty); (c) NO table-level `PRIMARY KEY` constraint exists in `table_constraints` (a table-level PK never produces a rowid alias even on a single column); (d) NO other column carries a column-level `PRIMARY KEY` (composite PK via repeated column-level constraints disqualifies); (e) `without_rowid` is false (WITHOUT ROWID tables never have a rowid alias). Returns Some(column_name) with the eligible column's name; None otherwise. Does NOT inspect ascending/descending — both ASC and DESC are accepted (the rowid-alias rule applies regardless of declared order).",
      "params": [
        { "name": "stmt", "type": { "borrow": "CreateTableStmt" } }
      ],
      "returns": { "option": "string" }
    }
  }
}
